{
  "$schema": "https://raw.githubusercontent.com/rfontes1987/wilanis-js/schemas-v1/packages/core/schemas/graph.schema.json",
  "description": "Data graph behind monitor.remove: DELETE the row. 200 is the deleted entry, 404 is the declared refusal for an id that does not exist, anything else is a failure.",
  "in": "@shapes/EntryRef.shape.json",
  "out": {
    "type": "@shapes/Entry.shape.json",
    "from": [
      "row",
      "missing",
      "failed"
    ]
  },
  "nodes": [
    {
      "type": "@wilanis/node/run.schema.json",
      "id": "asked",
      "run": "@http/http.port.json#request",
      "in": {
        "connection": "@connections/monitor-api.connection.json",
        "method": "DELETE",
        "path": "/monitor/{{in.id}}",
        "produces": "application/json",
        "returns": "@shapes/EntryRow.shape.json"
      }
    },
    {
      "type": "@wilanis/node/switch.schema.json",
      "id": "route",
      "in": {
        "status": "{{asked.status}}",
        "body": "{{asked.body}}"
      },
      "rules": [
        {
          "when": "status == 404",
          "to": "missing"
        },
        {
          "when": "status == 200 && has(body)",
          "to": "row"
        }
      ],
      "else": "failed"
    },
    {
      "type": "@wilanis/node/run.schema.json",
      "id": "row",
      "run": "@std/data.port.json#object",
      "in": {
        "value": "{{asked.body}}",
        "type": "@shapes/EntryRow.shape.json"
      }
    },
    {
      "type": "@wilanis/node/run.schema.json",
      "id": "missing",
      "run": "@std/flow.port.json#fail",
      "in": {
        "message": "no entry {{in.id}}",
        "type": "@shapes/Entry.shape.json"
      }
    },
    {
      "type": "@wilanis/node/run.schema.json",
      "id": "failed",
      "run": "@std/flow.port.json#fail",
      "in": {
        "message": "the monitor API answered {{asked.status}}",
        "type": "@shapes/Entry.shape.json"
      }
    }
  ]
}
