{
  "$schema": "https://raw.githubusercontent.com/rfontes1987/wilanis-js/schemas-v1/packages/core/schemas/graph.schema.json",
  "description": "Domain graph behind GET /monitor/{id}.",
  "in": "@shapes/EntryRef.shape.json",
  "out": {
    "type": "@shapes/Entry.shape.json",
    "from": "entry"
  },
  "nodes": [
    {
      "type": "@wilanis/node/run.schema.json",
      "id": "entry",
      "run": "@monitor/monitor.port.json#get",
      "in": {
        "id": "{{in.id}}"
      }
    }
  ]
}
