{
  "$schema": "https://raw.githubusercontent.com/rfontes1987/wilanis-js/schemas-v1/packages/core/schemas/graph.schema.json",
  "description": "Domain graph behind GET /monitor: narrowed when a method is given, everything otherwise. The two branches reconverge at out.from.",
  "in": "@shapes/MethodFilter.shape.json",
  "out": {
    "type": "@shapes/Entry.shape.json[]",
    "from": [
      "byMethod",
      "all"
    ]
  },
  "nodes": [
    {
      "type": "@wilanis/node/switch.schema.json",
      "id": "route",
      "in": {
        "method": "{{in.method}}"
      },
      "rules": [
        {
          "when": "has(method)",
          "to": "byMethod"
        }
      ],
      "else": "all"
    },
    {
      "type": "@wilanis/node/run.schema.json",
      "id": "byMethod",
      "run": "@monitor/monitor.port.json#listByMethod",
      "in": {
        "method": "{{in.method}}"
      }
    },
    {
      "type": "@wilanis/node/run.schema.json",
      "id": "all",
      "run": "@monitor/monitor.port.json#listAll"
    }
  ]
}
